{
  "$schema": "../../schemas/runtime-map.schema.json",
  "generatedAt": "2026-05-14T06:39:55.422Z",
  "os": "linux",
  "projectRoot": "/home/fmarzochi/Projects/everything-gemini",
  "stats": {
    "hotSkills": 32,
    "coldSkills": 228,
    "hotAgents": 1,
    "coldAgents": 62
  },
  "skills": [
    {
      "id": "ai-agent-eval",
      "name": "agent-eval",
      "namespace": "ai",
      "physicalPath": "skills/ai/agent-eval",
      "targetLink": ".agents/skills/ai-agent-eval",
      "status": "cold",
      "runtime": []
    },
    {
      "id": "ai-agent-harness-construction",
      "name": "agent-harness-construction",
      "namespace": "ai",
      "physicalPath": "skills/ai/agent-harness-construction",
      "targetLink": ".agents/skills/ai-agent-harness-construction",
      "status": "cold",
      "runtime": []
    },
    {
      "id": "ai-agent-introspection-debugging",
      "name": "agent-introspection-debugging",
      "namespace": "ai",
      "physicalPath": "skills/ai/agent-introspection-debugging",
      "targetLink": ".agents/skills/ai-agent-introspection-debugging",
      "status": "shadowed",
      "runtime": []
    },
    {
      "id": "ai-agent-sort",
      "name": "agent-sort",
      "namespace": "ai",
      "physicalPath": "skills/ai/agent-sort",
      "targetLink": ".agents/skills/ai-agent-sort",
      "status": "shadowed",
      "runtime": []
    },
    {
      "id": "ai-agentic-engineering",
      "name": "agentic-engineering",
      "namespace": "ai",
      "physicalPath": "skills/ai/agentic-engineering",
      "targetLink": ".agents/skills/ai-agentic-engineering",
      "status": "cold",
      "runtime": []
    },
    {
      "id": "ai-ai-first-engineering",
      "name": "ai-first-engineering",
      "namespace": "ai",
      "physicalPath": "skills/ai/ai-first-engineering",
      "targetLink": ".agents/skills/ai-ai-first-engineering",
      "status": "cold",
      "runtime": []
    },
    {
      "id": "ai-autonomous-agent-harness",
      "name": "autonomous-agent-harness",
      "namespace": "ai",
      "physicalPath": "skills/ai/autonomous-agent-harness",
      "targetLink": ".agents/skills/ai-autonomous-agent-harness",
      "status": "cold",
      "runtime": []
    },
    {
      "id": "ai-autonomous-loops",
      "name": "autonomous-loops",
      "namespace": "ai",
      "physicalPath": "skills/ai/autonomous-loops",
      "targetLink": ".agents/skills/ai-autonomous-loops",
      "status": "cold",
      "runtime": []
    },
    {
      "id": "ai-continuous-learning",
      "name": "continuous-learning",
      "namespace": "ai",
      "physicalPath": "skills/ai/continuous-learning",
      "targetLink": ".agents/skills/ai-continuous-learning",
      "status": "cold",
      "runtime": [
        "shell"
      ]
    },
    {
      "id": "ai-continuous-learning-v2",
      "name": "continuous-learning-v2",
      "namespace": "ai",
      "physicalPath": "skills/ai/continuous-learning-v2",
      "targetLink": ".agents/skills/ai-continuous-learning-v2",
      "status": "cold",
      "runtime": [
        "python",
        "shell"
      ]
    },
    {
      "id": "ai-cost-aware-llm-pipeline",
      "name": "cost-aware-llm-pipeline",
      "namespace": "ai",
      "physicalPath": "skills/ai/cost-aware-llm-pipeline",
      "targetLink": ".agents/skills/ai-cost-aware-llm-pipeline",
      "status": "cold",
      "runtime": []
    },
    {
      "id": "ai-deep-research",
      "name": "deep-research",
      "namespace": "ai",
      "physicalPath": "skills/ai/deep-research",
      "targetLink": ".agents/skills/ai-deep-research",
      "status": "shadowed",
      "runtime": []
    },
    {
      "id": "ai-exa-search",
      "name": "exa-search",
      "namespace": "ai",
      "physicalPath": "skills/ai/exa-search",
      "targetLink": ".agents/skills/ai-exa-search",
      "status": "shadowed",
      "runtime": []
    },
    {
      "id": "ai-fal-ai-media",
      "name": "fal-ai-media",
      "namespace": "ai",
      "physicalPath": "skills/ai/fal-ai-media",
      "targetLink": ".agents/skills/ai-fal-ai-media",
      "status": "shadowed",
      "runtime": []
    },
    {
      "id": "ai-prompt-optimizer",
      "name": "prompt-optimizer",
      "namespace": "ai",
      "physicalPath": "skills/ai/prompt-optimizer",
      "targetLink": ".agents/skills/ai-prompt-optimizer",
      "status": "cold",
      "runtime": []
    },
    {
      "id": "ai-regex-vs-llm-structured-text",
      "name": "regex-vs-llm-structured-text",
      "namespace": "ai",
      "physicalPath": "skills/ai/regex-vs-llm-structured-text",
      "targetLink": ".agents/skills/ai-regex-vs-llm-structured-text",
      "status": "cold",
      "runtime": []
    },
    {
      "id": "ai-token-budget-advisor",
      "name": "token-budget-advisor",
      "namespace": "ai",
      "physicalPath": "skills/ai/token-budget-advisor",
      "targetLink": ".agents/skills/ai-token-budget-advisor",
      "status": "cold",
      "runtime": []
    },
    {
      "id": "architecture-agent-architecture-audit",
      "name": "agent-architecture-audit",
      "namespace": "architecture",
      "physicalPath": "skills/architecture/agent-architecture-audit",
      "targetLink": ".agents/skills/architecture-agent-architecture-audit",
      "status": "cold",
      "runtime": []
    },
    {
      "id": "architecture-agentic-os",
      "name": "agentic-os",
      "namespace": "architecture",
      "physicalPath": "skills/architecture/agentic-os",
      "targetLink": ".agents/skills/architecture-agentic-os",
      "status": "cold",
      "runtime": []
    },
    {
      "id": "architecture-android-clean-architecture",
      "name": "android-clean-architecture",
      "namespace": "architecture",
      "physicalPath": "skills/architecture/android-clean-architecture",
      "targetLink": ".agents/skills/architecture-android-clean-architecture",
      "status": "cold",
      "runtime": []
    },
    {
      "id": "architecture-architecture-decision-records",
      "name": "architecture-decision-records",
      "namespace": "architecture",
      "physicalPath": "skills/architecture/architecture-decision-records",
      "targetLink": ".agents/skills/architecture-architecture-decision-records",
      "status": "cold",
      "runtime": []
    },
    {
      "id": "architecture-blueprint",
      "name": "blueprint",
      "namespace": "architecture",
      "physicalPath": "skills/architecture/blueprint",
      "targetLink": ".agents/skills/architecture-blueprint",
      "status": "cold",
      "runtime": []
    },
    {
      "id": "architecture-compose-multiplatform-patterns",
      "name": "compose-multiplatform-patterns",
      "namespace": "architecture",
      "physicalPath": "skills/architecture/compose-multiplatform-patterns",
      "targetLink": ".agents/skills/architecture-compose-multiplatform-patterns",
      "status": "cold",
      "runtime": []
    },
    {
      "id": "architecture-foundation-models-on-device",
      "name": "foundation-models-on-device",
      "namespace": "architecture",
      "physicalPath": "skills/architecture/foundation-models-on-device",
      "targetLink": ".agents/skills/architecture-foundation-models-on-device",
      "status": "cold",
      "runtime": []
    },
    {
      "id": "architecture-jpa-patterns",
      "name": "jpa-patterns",
      "namespace": "architecture",
      "physicalPath": "skills/architecture/jpa-patterns",
      "targetLink": ".agents/skills/architecture-jpa-patterns",
      "status": "cold",
      "runtime": []
    },
    {
      "id": "architecture-liquid-glass-design",
      "name": "liquid-glass-design",
      "namespace": "architecture",
      "physicalPath": "skills/architecture/liquid-glass-design",
      "targetLink": ".agents/skills/architecture-liquid-glass-design",
      "status": "cold",
      "runtime": []
    },
    {
      "id": "architecture-swiftui-patterns",
      "name": "swiftui-patterns",
      "namespace": "architecture",
      "physicalPath": "skills/architecture/swiftui-patterns",
      "targetLink": ".agents/skills/architecture-swiftui-patterns",
      "status": "cold",
      "runtime": []
    },
    {
      "id": "automation-carrier-relationship-management",
      "name": "carrier-relationship-management",
      "namespace": "automation",
      "physicalPath": "skills/automation/carrier-relationship-management",
      "targetLink": ".agents/skills/automation-carrier-relationship-management",
      "status": "cold",
      "runtime": []
    },
    {
      "id": "automation-customer-billing-ops",
      "name": "customer-billing-ops",
      "namespace": "automation",
      "physicalPath": "skills/automation/customer-billing-ops",
      "targetLink": ".agents/skills/automation-customer-billing-ops",
      "status": "cold",
      "runtime": []
    },
    {
      "id": "automation-energy-procurement",
      "name": "energy-procurement",
      "namespace": "automation",
      "physicalPath": "skills/automation/energy-procurement",
      "targetLink": ".agents/skills/automation-energy-procurement",
      "status": "cold",
      "runtime": []
    },
    {
      "id": "automation-finance-billing-ops",
      "name": "finance-billing-ops",
      "namespace": "automation",
      "physicalPath": "skills/automation/finance-billing-ops",
      "targetLink": ".agents/skills/automation-finance-billing-ops",
      "status": "cold",
      "runtime": []
    },
    {
      "id": "automation-inventory-demand-planning",
      "name": "inventory-demand-planning",
      "namespace": "automation",
      "physicalPath": "skills/automation/inventory-demand-planning",
      "targetLink": ".agents/skills/automation-inventory-demand-planning",
      "status": "cold",
      "runtime": []
    },
    {
      "id": "automation-lead-intelligence",
      "name": "lead-intelligence",
      "namespace": "automation",
      "physicalPath": "skills/automation/lead-intelligence",